{
    "format": "duo-test-catalog-fragment/v1",
    "inventory": [
        {
            "kind": "file",
            "name": "sandbox/conformance/artifacts-cache/.gitkeep",
            "role": "helper",
            "suite_ids": [
                "legacy-regress-action-provider-grammar"
            ]
        },
        {
            "kind": "file",
            "name": "sandbox/conformance/artifacts.lock.json",
            "role": "fixture",
            "suite_ids": [
                "legacy-regress-action-provider-grammar"
            ]
        },
        {
            "kind": "file",
            "name": "sandbox/conformance/asserts.sh",
            "role": "helper",
            "suite_ids": [
                "legacy-regress-action-provider-grammar"
            ]
        },
        {
            "kind": "file",
            "name": "sandbox/conformance/checks/_explain_registry.sh",
            "role": "helper",
            "suite_ids": [
                "legacy-regress-explain-registry"
            ]
        },
        {
            "kind": "file",
            "name": "sandbox/conformance/checks/_retry_helper.sh",
            "role": "helper",
            "suite_ids": [
                "legacy-regress-action-provider-grammar"
            ]
        },
        {
            "kind": "file",
            "name": "sandbox/conformance/checks/acf.sh",
            "role": "helper",
            "suite_ids": [
                "legacy-regress-action-provider-grammar"
            ]
        },
        {
            "kind": "file",
            "name": "sandbox/conformance/checks/contact-form-7.sh",
            "role": "helper",
            "suite_ids": [
                "legacy-regress-action-provider-grammar"
            ]
        },
        {
            "kind": "file",
            "name": "sandbox/conformance/checks/core.sh",
            "role": "helper",
            "suite_ids": [
                "legacy-regress-action-provider-grammar"
            ]
        },
        {
            "kind": "file",
            "name": "sandbox/conformance/checks/elementor.sh",
            "role": "helper",
            "suite_ids": [
                "legacy-regress-action-provider-grammar"
            ]
        },
        {
            "kind": "file",
            "name": "sandbox/conformance/checks/fse.sh",
            "role": "helper",
            "suite_ids": [
                "legacy-regress-action-provider-grammar"
            ]
        },
        {
            "kind": "file",
            "name": "sandbox/conformance/checks/ninja-forms.sh",
            "role": "helper",
            "suite_ids": [
                "legacy-regress-action-provider-grammar"
            ]
        },
        {
            "kind": "file",
            "name": "sandbox/conformance/checks/paid-memberships-pro.sh",
            "role": "helper",
            "suite_ids": [
                "legacy-regress-action-provider-grammar"
            ]
        },
        {
            "kind": "file",
            "name": "sandbox/conformance/checks/polylang.sh",
            "role": "helper",
            "suite_ids": [
                "legacy-regress-action-provider-grammar"
            ]
        },
        {
            "kind": "file",
            "name": "sandbox/conformance/checks/woocommerce.sh",
            "role": "helper",
            "suite_ids": [
                "legacy-regress-action-provider-grammar"
            ]
        },
        {
            "kind": "file",
            "name": "sandbox/conformance/checks/yoast.sh",
            "role": "helper",
            "suite_ids": [
                "legacy-regress-action-provider-grammar"
            ]
        },
        {
            "kind": "file",
            "name": "sandbox/conformance/entries/acf.json",
            "role": "fixture",
            "suite_ids": [
                "legacy-regress-action-provider-grammar"
            ]
        },
        {
            "kind": "file",
            "name": "sandbox/conformance/entries/contact-form-7.json",
            "role": "fixture",
            "suite_ids": [
                "legacy-regress-action-provider-grammar"
            ]
        },
        {
            "kind": "file",
            "name": "sandbox/conformance/entries/core.json",
            "role": "fixture",
            "suite_ids": [
                "legacy-regress-action-provider-grammar"
            ]
        },
        {
            "kind": "file",
            "name": "sandbox/conformance/entries/elementor.json",
            "role": "fixture",
            "suite_ids": [
                "legacy-regress-action-provider-grammar"
            ]
        },
        {
            "kind": "file",
            "name": "sandbox/conformance/entries/fse.json",
            "role": "fixture",
            "suite_ids": [
                "legacy-regress-action-provider-grammar"
            ]
        },
        {
            "kind": "file",
            "name": "sandbox/conformance/entries/ninja-forms.json",
            "role": "fixture",
            "suite_ids": [
                "legacy-regress-action-provider-grammar"
            ]
        },
        {
            "kind": "file",
            "name": "sandbox/conformance/entries/paid-memberships-pro.json",
            "role": "fixture",
            "suite_ids": [
                "legacy-regress-action-provider-grammar"
            ]
        },
        {
            "kind": "file",
            "name": "sandbox/conformance/entries/polylang.json",
            "role": "fixture",
            "suite_ids": [
                "legacy-regress-action-provider-grammar"
            ]
        },
        {
            "kind": "file",
            "name": "sandbox/conformance/entries/woocommerce.json",
            "role": "fixture",
            "suite_ids": [
                "legacy-regress-action-provider-grammar"
            ]
        },
        {
            "kind": "file",
            "name": "sandbox/conformance/entries/yoast.json",
            "role": "fixture",
            "suite_ids": [
                "legacy-regress-action-provider-grammar"
            ]
        },
        {
            "kind": "file",
            "name": "sandbox/conformance/manifests.json",
            "role": "fixture",
            "suite_ids": [
                "legacy-regress-action-provider-grammar"
            ]
        },
        {
            "kind": "file",
            "name": "sandbox/conformance/postdeploy/contact-form-7.sh",
            "role": "helper",
            "suite_ids": [
                "legacy-regress-action-provider-grammar"
            ]
        },
        {
            "kind": "file",
            "name": "sandbox/conformance/postdeploy/core.sh",
            "role": "helper",
            "suite_ids": [
                "legacy-regress-action-provider-grammar"
            ]
        },
        {
            "kind": "file",
            "name": "sandbox/conformance/postdeploy/ninja-forms.sh",
            "role": "helper",
            "suite_ids": [
                "legacy-regress-action-provider-grammar"
            ]
        },
        {
            "kind": "file",
            "name": "sandbox/conformance/postdeploy/woocommerce.sh",
            "role": "helper",
            "suite_ids": [
                "legacy-regress-action-provider-grammar"
            ]
        },
        {
            "kind": "file",
            "name": "sandbox/conformance/run.sh",
            "role": "helper",
            "suite_ids": [
                "legacy-regress-action-provider-grammar"
            ]
        },
        {
            "kind": "file",
            "name": "sandbox/conformance/seeds/acf.sh",
            "role": "helper",
            "suite_ids": [
                "legacy-regress-action-provider-grammar"
            ]
        },
        {
            "kind": "file",
            "name": "sandbox/conformance/seeds/contact-form-7.sh",
            "role": "helper",
            "suite_ids": [
                "legacy-regress-action-provider-grammar"
            ]
        },
        {
            "kind": "file",
            "name": "sandbox/conformance/seeds/core.sh",
            "role": "helper",
            "suite_ids": [
                "legacy-regress-action-provider-grammar"
            ]
        },
        {
            "kind": "file",
            "name": "sandbox/conformance/seeds/elementor.sh",
            "role": "helper",
            "suite_ids": [
                "legacy-regress-action-provider-grammar"
            ]
        },
        {
            "kind": "file",
            "name": "sandbox/conformance/seeds/fse.sh",
            "role": "helper",
            "suite_ids": [
                "legacy-regress-action-provider-grammar"
            ]
        },
        {
            "kind": "file",
            "name": "sandbox/conformance/seeds/ninja-forms.sh",
            "role": "helper",
            "suite_ids": [
                "legacy-regress-action-provider-grammar"
            ]
        },
        {
            "kind": "file",
            "name": "sandbox/conformance/seeds/paid-memberships-pro.sh",
            "role": "helper",
            "suite_ids": [
                "legacy-regress-action-provider-grammar"
            ]
        },
        {
            "kind": "file",
            "name": "sandbox/conformance/seeds/polylang.sh",
            "role": "helper",
            "suite_ids": [
                "legacy-regress-action-provider-grammar"
            ]
        },
        {
            "kind": "file",
            "name": "sandbox/conformance/seeds/woocommerce.sh",
            "role": "helper",
            "suite_ids": [
                "legacy-regress-action-provider-grammar"
            ]
        },
        {
            "kind": "file",
            "name": "sandbox/conformance/seeds/yoast.sh",
            "role": "helper",
            "suite_ids": [
                "legacy-regress-action-provider-grammar"
            ]
        },
        {
            "kind": "file",